{
  "contract_version": "1.0",
  "tool": "FastAPI",
  "version": "0.115.2",
  "primary_source_url": "https://fastapi.tiangolo.com/",
  "verified_date": "2026-10-12",
  "ring": "adopt",
  "adr": "ADR-0004",
  "evaluation": {
    "concern": "HTTP API framework",
    "chosen": "FastAPI",
    "candidates": [
      {
        "name": "FastAPI",
        "version": "0.115.2",
        "source_url": "https://fastapi.tiangolo.com/",
        "verified": "2026-10-12",
        "license": "MIT",
        "maturity": {
          "last_release": "2026-09-30",
          "maintainers": 3,
          "stars": 80000
        },
        "maintenance": "monthly releases, three active maintainers",
        "size": "about 40 transitive dependencies",
        "fit": "typed request and response models match the catalog schemas",
        "risks": [
          "pydantic major upgrades"
        ]
      },
      {
        "name": "Flask",
        "version": "3.0.3",
        "source_url": "https://flask.palletsprojects.com/",
        "verified": "2026-10-12",
        "license": "BSD-3-Clause",
        "maturity": {
          "last_release": "2026-09-30",
          "maintainers": 3,
          "stars": 80000
        },
        "maintenance": "monthly releases, three active maintainers",
        "size": "about 40 transitive dependencies",
        "fit": "no native schema validation",
        "risks": []
      }
    ]
  }
}
